{
  "section_id": "H",
  "section_title": "Production Planning and Control",
  "generated_at": "2026-03-11T00:00:00Z",
  "concepts": [
    {
      "id": "H.1",
      "topic": "Describe different types of supply chain management planning.",
      "action_verb": "describe",
      "definition": "Supply chain management planning encompasses three primary levels -- strategic, tactical, and operational -- each addressing different time horizons and decision scopes to align supply with demand.",
      "explanation": "Strategic planning is a long-term approach that defines the overall supply chain direction, including supplier selection, warehouse placement, and market alignment, typically reviewed annually. Tactical planning is a mid-range approach that sets production, inventory, and distribution priorities over a medium-term horizon such as a quarter or seasonal cycle, often referred to as master planning. Operational planning focuses on day-to-day execution including inventory management, logistics coordination, and performance monitoring. Together, these three levels ensure that supply chain activities are coordinated from high-level strategy down to daily operations.",
      "key_terms": [
        "strategic planning",
        "tactical planning",
        "operational planning",
        "demand planning",
        "sales and operations planning"
      ],
      "sources": [
        {
          "url": "https://www.planettogether.com/aps-trends/mastering-the-three-levels-of-supply-chain-management",
          "title": "Mastering the Three Levels of Supply Chain Management",
          "site": "PlanetTogether"
        },
        {
          "url": "https://precoro.com/blog/supply-chain-planning/",
          "title": "Supply Chain Planning 101: From Basics to Best Practices",
          "site": "Precoro"
        },
        {
          "url": "https://cscmp.org/CSCMP/CSCMP/Develop/Starting_Your_Career/Supply_Chain_Management_Concepts.aspx",
          "title": "Supply Chain Management Concepts",
          "site": "CSCMP"
        }
      ],
      "relationships": [
        {
          "target_id": "H.2",
          "type": "related_to",
          "description": "Static and dynamic planning are approaches applied within these planning levels."
        },
        {
          "target_id": "H.3",
          "type": "related_to",
          "description": "The master production schedule is a key output of tactical planning."
        }
      ],
      "quiz": {
        "bloom_level": "understand",
        "difficulty": "medium",
        "distractor_ids": ["H.2", "H.3"]
      }
    },
    {
      "id": "H.2",
      "topic": "Define Static vs. Dynamic Planning.",
      "action_verb": "define",
      "definition": "Static planning uses a fixed plan generated at a point in time that remains unchanged until the next planning cycle, while dynamic planning continuously updates the plan as master data changes such as new orders or demand shifts.",
      "explanation": "A static plan is generated through a master planning calculation using current data and remains stable until the next scheduled regeneration. It serves as an operating plan that personnel such as purchasers and production planners use for daily decision-making. A dynamic plan starts with the same baseline but is updated every time master data changes, such as when a new sales order is created, allowing the company to monitor the changing order network and item availability in real time. The dynamic approach uses net change calculations for faster processing, while the static plan provides a consistent reference point for operational activities.",
      "key_terms": [
        "static planning",
        "dynamic planning",
        "net change",
        "regenerative planning",
        "master data"
      ],
      "sources": [
        {
          "url": "https://learn.microsoft.com/en-us/dynamics365/supply-chain/master-planning/deprecated-master-plans",
          "title": "Set up master plans for the deprecated planning engine",
          "site": "Microsoft Learn"
        },
        {
          "url": "https://www.goarmstrong.com/resources/risk-of-static-supply-chain/",
          "title": "Static vs. Dynamic Supply Chains: The Path to Resilience",
          "site": "Armstrong"
        },
        {
          "url": "https://fareye.com/resources/blogs/static-vs-dynamic-route-planning",
          "title": "Static Route vs Dynamic Route Planning: A Practical Guide",
          "site": "FarEye"
        }
      ],
      "relationships": [
        {
          "target_id": "H.1",
          "type": "related_to",
          "description": "Static and dynamic are planning approaches used within the broader types of SCM planning."
        },
        {
          "target_id": "H.3",
          "type": "related_to",
          "description": "The master production schedule can be managed using either static or dynamic planning methods."
        }
      ],
      "quiz": {
        "bloom_level": "remember",
        "difficulty": "easy",
        "distractor_ids": ["H.1", "H.3"]
      }
    },
    {
      "id": "H.3",
      "topic": "Explain how a master production schedule is determined.",
      "action_verb": "explain",
      "definition": "A master production schedule (MPS) is a plan that specifies what products will be manufactured, in what quantities, and when, serving as the bridge between demand forecasts and detailed production planning.",
      "explanation": "The MPS is determined by taking into account demand forecasts, the sales and operations plan, current customer orders (backlog), available inventory, material availability, production capacity constraints, and management policies. It translates aggregate planning into a specific build schedule for individual end items expressed in configurations, quantities, and dates. The MPS drives material requirements planning (MRP) by defining what finished goods need to be produced, which in turn determines the raw materials and components required. Time fences are established to control changes to the schedule, ensuring stability in near-term production while allowing flexibility for longer-term adjustments. The planning horizon must be at least as long as the longest cumulative lead time for any item in the plan.",
      "key_terms": [
        "master production schedule",
        "MPS",
        "planning horizon",
        "time fence",
        "material requirements planning",
        "demand forecast"
      ],
      "sources": [
        {
          "url": "https://en.wikipedia.org/wiki/Master_production_schedule",
          "title": "Master production schedule",
          "site": "Wikipedia"
        },
        {
          "url": "https://www.optiproerp.com/blog/inventory-management-101-master-production-schedule-mps-explained/",
          "title": "Master Production Schedule (MPS) Guide",
          "site": "OptiProERP"
        },
        {
          "url": "https://williechen58.wordpress.com/2005/11/25/master-production-schedule-mps-define-in-apics-dictionary-11-edition/",
          "title": "Master Production Schedule (MPS) define in APICS Dictionary 11 Edition",
          "site": "Willie Chen Blog (APICS reference)"
        }
      ],
      "relationships": [
        {
          "target_id": "H.1",
          "type": "related_to",
          "description": "The MPS is a key output of tactical-level supply chain planning."
        },
        {
          "target_id": "H.4",
          "type": "related_to",
          "description": "The MPS uses the bill of materials to determine component and material requirements."
        },
        {
          "target_id": "H.5",
          "type": "related_to",
          "description": "The MPS drives raw material procurement through material requirements planning."
        }
      ],
      "quiz": {
        "bloom_level": "understand",
        "difficulty": "medium",
        "distractor_ids": ["H.1", "H.4"]
      }
    },
    {
      "id": "H.4",
      "topic": "Define Bill of Material (BOM).",
      "action_verb": "define",
      "definition": "A bill of materials (BOM) is a comprehensive, structured list of all raw materials, components, sub-assemblies, and the quantities of each needed to manufacture a finished product.",
      "explanation": "The BOM serves as the foundation for production planning systems, providing essential data for manufacturing resource planning, product costing, and material provisioning. A single-level BOM lists only the immediate components of a product, while a multi-level (indented) BOM shows the complete hierarchy including sub-assemblies and their constituent parts. BOMs are critical for material requirements planning (MRP), where the master production schedule is exploded through the BOM to determine what materials need to be purchased and when. They also support inventory planning, scheduling, and cost estimation across the supply chain.",
      "key_terms": [
        "bill of materials",
        "BOM",
        "single-level BOM",
        "multi-level BOM",
        "material requirements planning",
        "product structure"
      ],
      "sources": [
        {
          "url": "https://www.cips.org/intelligence-hub/operations-management/bills-of-material",
          "title": "Bills of Material (BOM) In the Supply Chain",
          "site": "CIPS"
        },
        {
          "url": "https://www.netsuite.com/portal/resource/articles/erp/bill-of-materials-bom.shtml",
          "title": "What Is a Bill of Materials (BOM)? The Complete Guide to BOMs",
          "site": "NetSuite"
        },
        {
          "url": "https://gainsystems.com/blog/bill-of-materials-bom-in-supply-chain-management-impacts-and-examples/",
          "title": "Bill of Materials (BOM) in Supply Chain Management: Impacts and Examples",
          "site": "Gain Systems"
        }
      ],
      "relationships": [
        {
          "target_id": "H.3",
          "type": "related_to",